{
  "assigned_source_indices": [
    0,
    1,
    2,
    3,
    4,
    5
  ],
  "input_bindings": {
    "/dev/shm/wikigraph_v15/external/source_render_natural_v17/attempt01/review_index.json": "85172ba6d24100df49647b913c324107d36712495f14ded487c04ca44eca54bc",
    "/dev/shm/wikigraph_v15/external/source_render_review_v17/css_subset00_05/source_05_paragraph_1101_boundary_note.json": "69da9aafca3e0694e428d1f4fd24edd70f32aa47e39634c1d8664c65877be83b",
    "/dev/shm/wikigraph_v15/external/source_render_review_v17/css_subset00_05/source_text_numeric_count_addendum.json": "d5f817789331400218e7a17e335080469b1855fe72d8f23af6e64c26e9bc5bbe",
    "/dev/shm/wikigraph_v15/external/source_render_review_v17/css_subset00_05/worksheet_index.json": "ff4097e4964eb955f01ad9aaa5b55198e9d39b19acc024c45e916aafe25a9fe4",
    "data/reader_binding_v17/source_render_admission_review_plan.json": "8935f5cb446c0e57165907ef78c8c13a8bf9be0b30efc6c53774a412c7283aad",
    "data/reader_binding_v17/source_render_admission_schema.json": "17bf3f93be14c53ee2282e242c294edee6f4c39515922aeb8cafac1b53a7eadd",
    "data/reader_binding_v17/source_render_natural_protocol_v17.json": "a030efb9dcc9d144eee72595c714dfa64eeb05bccdde0b7fa43b5357f266f4c7",
    "docs/source_render_admission_contract_v17.txt": "bed3757fb6cda3544f4fb7dbb0a64fc19abc67aae51100f6dd015c7d64eb9926",
    "results/source_render_code_review_v17.json": "bbe85c24e80a6e702e8840ffe3916af1aa51832bb29eec1e96d4d16d02347253",
    "results/source_render_css_binding_review_00_05_v17.json": "857fc7b959bec9990aa0b3c30a792a934bed2f86c550060d7bc546b56b7b89ea",
    "results/source_render_natural_execution_v17.json": "14b97956be21d0e91a2d6f299bc2f13ab4f08c104caf2e0bc164dabd1ed38a54",
    "results/source_render_population_review_v17.json": "6105bd6b34f7986a84a55dea45eb352790aee222e66e94df924d70f317b678f1"
  },
  "reviewed_at_utc": "2026-10-04T11:19:58.764844+00:00",
  "reviewer": "table_views_v16",
  "schema_version": "source_render_admission_v17",
  "scope": {
    "browser_equivalence_claimed": false,
    "complete_evidence_verified": false,
    "financial_truth_claimed": false,
    "model_calls": 0,
    "questions_authored": 0,
    "semantic_attachment_verified": false
  },
  "sources": [
    {
      "blocks": [
        {
          "anchor": {
            "byte_start": 2710935,
            "byte_stop": 2712806,
            "span_sha256": "a1e93396793a5fdcd5834911a5e2e7c934918f2c2b99608c3ab60f54f3917c36"
          },
          "block_id": "paragraph_1125",
          "checks": {
            "all_pages_visually_inspected": "pass",
            "assembly_and_render_input": "pass",
            "in_block_labels_and_markers": "pass",
            "row_cell_span_and_numeric_mapping": "not_applicable",
            "source_css_dependencies": "pass",
            "source_identity_and_fragment": "pass",
            "text_glyphs_and_clipping": "pass"
          },
          "decision": "admitted_as_qualified_inspection_view",
          "dom_path": "/{http://www.w3.org/1999/xhtml}html[1]/{http://www.w3.org/1999/xhtml}body[1]/{http://www.xbrl.org/2013/inlineXBRL}continuation[9]/{http://www.xbrl.org/2013/inlineXBRL}continuation[1]/{http://www.w3.org/1999/xhtml}div[2]",
          "kind": "paragraph",
          "private_review_evidence": {
            "bytes": 2753,
            "filename": "final_subset00_05/source_00.block_00.paragraph_1125.json",
            "sha256": "b61d05a2c3455c4eca6f412c6c203a96a7c19956b1f544675838bf0b5298e979"
          },
          "raster_page_indices_inspected": [
            0
          ],
          "raster_pages_available": 1,
          "reason_codes": [],
          "render_status": "rendered_pending_full_visual_and_css_review",
          "reviewed_artifacts": [
            {
              "bytes": 21050,
              "filename": "source_00/block_00/rendered/source-block.pdf",
              "sha256": "7429443936e404dfb0995651825fc32f77087de2f232afe264e4ef147a41d2dd"
            },
            {
              "bytes": 555,
              "filename": "source_00/block_00/rendered/source-block.txt",
              "sha256": "0b48d95a9215c6df25a6774950373665c5259a6aa3f7d2647e78f877c80a3734"
            },
            {
              "bytes": 2810,
              "filename": "source_00/block_00/source-assembly.html",
              "sha256": "3e0a6674417904a55f6daa57bf111e3648af3e16773dfb53394beba5326371c0"
            },
            {
              "bytes": 2878,
              "filename": "source_00/block_00/source-block.html",
              "sha256": "631e6e5affb9fb29811c586c29c52370e2d965f670274adbb8ca5a87076fa06d"
            },
            {
              "bytes": 1871,
              "filename": "source_00/block_00/source-fragment.xml",
              "sha256": "a1e93396793a5fdcd5834911a5e2e7c934918f2c2b99608c3ab60f54f3917c36"
            },
            {
              "bytes": 29010,
              "filename": "source_00/block_00/raster/page-1.png",
              "sha256": "971565abd0bd3d574079f91252311223d59df69e7c11825e6c451f1fe1dcfaee"
            }
          ]
        },
        {
          "anchor": {
            "byte_start": 2712806,
            "byte_stop": 2713079,
            "span_sha256": "fd00091a11dd88c3303643a8e761eafbe1ad005eddbb5deaa31cbd570daae66b"
          },
          "block_id": "paragraph_1126",
          "checks": {
            "all_pages_visually_inspected": "pass",
            "assembly_and_render_input": "pass",
            "in_block_labels_and_markers": "pass",
            "row_cell_span_and_numeric_mapping": "not_applicable",
            "source_css_dependencies": "pass",
            "source_identity_and_fragment": "pass",
            "text_glyphs_and_clipping": "pass"
          },
          "decision": "admitted_as_qualified_inspection_view",
          "dom_path": "/{http://www.w3.org/1999/xhtml}html[1]/{http://www.w3.org/1999/xhtml}body[1]/{http://www.xbrl.org/2013/inlineXBRL}continuation[9]/{http://www.xbrl.org/2013/inlineXBRL}continuation[1]/{http://www.w3.org/1999/xhtml}div[3]",
          "kind": "paragraph",
          "private_review_evidence": {
            "bytes": 1944,
            "filename": "final_subset00_05/source_00.block_01.paragraph_1126.json",
            "sha256": "adbf2856ad260a1afa68354eaa691ae75889066bef733742b1a1df2b913248b8"
          },
          "raster_page_indices_inspected": [
            0
          ],
          "raster_pages_available": 1,
          "reason_codes": [],
          "render_status": "rendered_pending_full_visual_and_css_review",
          "reviewed_artifacts": [
            {
              "bytes": 15464,
              "filename": "source_00/block_01/rendered/source-block.pdf",
              "sha256": "b824ad35782ccc5aba630773436b1a01c160f387751a2a787c325b873d054709"
            },
            {
              "bytes": 151,
              "filename": "source_00/block_01/rendered/source-block.txt",
              "sha256": "1348d9add246437fbec6a21651b1d7beadce598c7af4875db633e5c592fa5c78"
            },
            {
              "bytes": 1212,
              "filename": "source_00/block_01/source-assembly.html",
              "sha256": "7b90358bb3e57afeb4615a1d6b2a29bc2d1f448849162ebf6a7f4f1b329a3e35"
            },
            {
              "bytes": 1280,
              "filename": "source_00/block_01/source-block.html",
              "sha256": "35de391d3bbd00e48d1eee1e80eab652b74b4d5b1bc0f2dfc38ffe2f52e99e42"
            },
            {
              "bytes": 273,
              "filename": "source_00/block_01/source-fragment.xml",
              "sha256": "fd00091a11dd88c3303643a8e761eafbe1ad005eddbb5deaa31cbd570daae66b"
            },
            {
              "bytes": 14341,
              "filename": "source_00/block_01/raster/page-1.png",
              "sha256": "b6f29f1235c163ffca9600dbb220a962bf2777580cf51c22bf6b99313c47c1d2"
            }
          ]
        },
        {
          "anchor": {
            "byte_start": 2713110,
            "byte_stop": 2721252,
            "span_sha256": "ad9f5671d86db135715727a8f863f722ad1c5d542ebb4f4d2f8bbc33a32f2f8f"
          },
          "block_id": "table_142",
          "checks": {
            "all_pages_visually_inspected": "pass",
            "assembly_and_render_input": "pass",
            "in_block_labels_and_markers": "pass",
            "row_cell_span_and_numeric_mapping": "pass",
            "source_css_dependencies": "pass",
            "source_identity_and_fragment": "pass",
            "text_glyphs_and_clipping": "pass"
          },
          "decision": "admitted_as_qualified_inspection_view",
          "dom_path": "/{http://www.w3.org/1999/xhtml}html[1]/{http://www.w3.org/1999/xhtml}body[1]/{http://www.xbrl.org/2013/inlineXBRL}continuation[9]/{http://www.xbrl.org/2013/inlineXBRL}continuation[1]/{http://www.w3.org/1999/xhtml}div[4]/{http://www.w3.org/1999/xhtml}table[1]",
          "kind": "table",
          "private_review_evidence": {
            "bytes": 7689,
            "filename": "final_subset00_05/source_00.block_02.table_142.json",
            "sha256": "5f7748d556f85fe339f8cc1b0a74f6b2978dea11983e43a0eac8dc2d6a6170d7"
          },
          "raster_page_indices_inspected": [
            0
          ],
          "raster_pages_available": 1,
          "reason_codes": [],
          "render_status": "rendered_pending_full_visual_and_css_review",
          "reviewed_artifacts": [
            {
              "bytes": 32464,
              "filename": "source_00/block_02/rendered/source-block.pdf",
              "sha256": "e5d190f0a88b647cbe1e2c7fd244ee4ef81e49522c95218adb89246ce89dec74"
            },
            {
              "bytes": 334,
              "filename": "source_00/block_02/rendered/source-block.txt",
              "sha256": "d8e1fa17ab2c7f5d45c7f4df75f2167fe1e2bb567a50f755ee91a8efae163ee4"
            },
            {
              "bytes": 9118,
              "filename": "source_00/block_02/source-assembly.html",